[
  {
    "agency_id": "witt",
    "name": "Western Institute of Technology at Taranaki (WITT)",
    "type": "ITP/Polytechnic",
    "portfolio": "Education",
    "official_website": "https://www.witt.ac.nz",
    "status": "active",
    "social_profiles": {
      "facebook": {
        "handle": "WITTNZ",
        "url": "https://www.facebook.com/WITTNZ",
        "status": "active",
        "discovered_at": "2026-06"
      },
      "linkedin": {
        "handle": "WITT",
        "url": "https://www.linkedin.com/school/witt",
        "status": "active",
        "discovered_at": "2026-06"
      },
      "instagram": {
        "handle": "wittnz",
        "url": "https://www.instagram.com/wittnz",
        "status": "active",
        "discovered_at": "2026-06"
      },
      "youtube": {
        "handle": "WITTNZ",
        "url": "https://www.youtube.com/@WITTNZ",
        "status": "active",
        "discovered_at": "2026-06"
      }
    }
  }
]