[
  {
    "agency_id": "kawerau-district-council",
    "name": "Kawerau District Council",
    "type": "District Council",
    "portfolio": "Local Government",
    "official_website": "https://www.kaweraudc.govt.nz",
    "status": "active",
    "social_profiles": {
      "facebook": {
        "handle": "KawerauDistrictCouncil",
        "url": "https://www.facebook.com/KawerauDistrictCouncil",
        "status": "active",
        "discovered_at": "2026-06"
      }
    }
  }
]