[
  {
    "agency_id": "health-and-disability-commissioner",
    "name": "Health and Disability Commissioner (Te Toihau Hauora, Hauātanga)",
    "type": "Independent Crown Entity",
    "portfolio": "Health",
    "official_website": "https://www.hdc.org.nz",
    "status": "active",
    "social_profiles": {
      "linkedin": {
        "handle": "Health and Disability Commissioner",
        "url": "https://www.linkedin.com/company/health-and-disability-commissioner",
        "status": "active",
        "discovered_at": "2026-06"
      }
    }
  }
]